{"schema":"zero3.commander.command.execution-submit/1.0","command":"execution.submit","protocol_version":"1.0","execution_id":"chatgpt-node-build2-20260828T1955Z","commander_id":"chatgpt-web-session","issued_at":"2026-08-28T19:55:00Z","idempotency_key":"chatgpt-node-build2-20260828T1955Z","payload":{"execution_id":"chatgpt-node-build2-20260828T1955Z","capability":"test.build","args":{}}}