{
  "schema":"zero3.commander.command.execution-submit/1.0",
  "command":"execution.submit",
  "execution_id":"chatgpt-complete-patch2-20260828T1753Z",
  "commander_id":"chatgpt-web-session",
  "issued_at":"2026-08-28T17:53:00Z",
  "payload":{
    "execution_id":"chatgpt-complete-patch2-20260828T1753Z",
    "capability":"file.patch",
    "args":{
      "diff":"diff --git a/crates/zero3-providers/src/browser.rs b/crates/zero3-providers/src/browser.rs\n--- a/crates/zero3-providers/src/browser.rs\n+++ b/crates/zero3-providers/src/browser.rs\n@@ -247,7 +247,7 @@ impl CdpBrowserProvider {\n     }\n \n     async fn close(&self) -> anyhow::Result<Value> {\n-        let session = self\n+        let mut session = self\n             .session\n             .lock()\n             .await\n"
    }
  }
}
