{
  "schema": "zero3.commander.command.execution-submit/1.0",
  "command": "execution.submit",
  "execution_id": "chatgpt-installer-weixin-build2-20260828T2111Z",
  "commander_id": "chatgpt-web-session",
  "issued_at": "2026-08-28T21:11:30Z",
  "payload": {
    "capability": "test.build",
    "args": {},
    "execution_id": "chatgpt-installer-weixin-build2-20260828T2111Z"
  }
}