{
  "schema": "zero3.commander.command.execution-submit/1.0",
  "command": "execution.submit",
  "protocol_version": "1.0",
  "execution_id": "chatgpt-router-write-agent-runtime-20260829T0211Z",
  "commander_id": "chatgpt-web-session",
  "issued_at": "2026-08-29T02:11:00Z",
  "idempotency_key": "chatgpt-router-write-agent-runtime-20260829T0211Z",
  "payload": {
    "execution_id": "chatgpt-router-write-agent-runtime-20260829T0211Z",
    "capability": "file.write",
    "args": {
      "path": "apps/node/src/agent_runtime.rs",
      "content": "use std::path::{Path, PathBuf};\nuse std::sync::Arc;\n\nuse serde_json::{json, Value};\nuse zero3_core::subagent::SubagentTask;\nuse zero3_skills::{FilesystemSkillProvider, SkillRegistry, SkillRoot};\nuse zero3_subagents::RouteRequest;\n\nuse super::{action_gate, AgentRunRequest, AppState};\n\npub(super) fn build_skill_registry(data_dir: &Path) -> anyhow::Result<Arc<SkillRegistry>> {\n    let registry = Arc::new(SkillRegistry::new());\n    let mut roots = Vec::new();\n\n    if let Some(value) = std::env::var_os(\"ZERO3_SKILL_ROOTS\") {\n        for path in std::env::split_paths(&value) {\n            roots.push(SkillRoot::new(path, \"custom\", 0));\n        }\n    }\n\n    if let Ok(cwd) = std::env::current_dir() {\n        roots.push(SkillRoot::new(cwd.join(\".agents/skills\"), \"project-agents\", 10));\n        roots.push(SkillRoot::new(cwd.join(\".codex/skills\"), \"project-codex\", 11));\n    }\n\n    roots.push(SkillRoot::new(data_dir.join(\"skills\"), \"zero3-user\", 20));\n\n    if let Some(home) = std::env::var_os(\"HOME\").or_else(|| std::env::var_os(\"USERPROFILE\")) {\n        let home = PathBuf::from(home);\n        roots.push(SkillRoot::new(home.join(\".agents/skills\"), \"user-agents\", 30));\n        roots.push(SkillRoot::new(home.join(\".codex/skills\"), \"user-codex\", 31));\n    }\n\n    registry.register_provider(Arc::new(FilesystemSkillProvider::new(roots)))?;\n    Ok(registry)\n}\n\npub(super) async fn execute_agent_request(\n    state: &AppState,\n    request: AgentRunRequest,\n) -> anyhow::Result<Value> {\n    let snapshot = state.skills.snapshot(None).await;\n    let available_backends = state.agents.list();\n    let routing_goal = if request.skills.is_empty() {\n        request.goal.clone()\n    } else {\n        format!(\"{} {}\", request.goal, request.skills.join(\" \"))\n    };\n    let decision = state.agent_router.route(RouteRequest {\n        goal: &routing_goal,\n        preferred_backend: Some(&request.backend),\n        available_backends: &available_backends,\n        skills: &snapshot.skills,\n    })?;\n\n    let explicitly_selected = !request.skills.is_empty();\n    let selected_names = if explicitly_selected {\n        request.skills.clone()\n    } else {\n        decision.matched_skills.clone()\n    };\n    if selected_names.len() > 8 {\n        return Err(anyhow::anyhow!(\"at most 8 skills may be loaded for one task\"));\n    }\n\n    let mut loaded_skills = Vec::new();\n    for name in selected_names {\n        let definition = state\n            .skills\n            .get(&name, None)\n            .await?\n            .ok_or_else(|| anyhow::anyhow!(\"requested skill {name:?} was not found\"))?;\n        if explicitly_selected && !definition.summary.invocation.user_invocable {\n            return Err(anyhow::anyhow!(\n                \"skill {:?} is not user-invocable\",\n                definition.summary.name\n            ));\n        }\n        if !explicitly_selected && !definition.summary.invocation.model_invocable {\n            continue;\n        }\n        action_gate(\n            request.approval.granted_level,\n            request.approval.approved,\n            \"skill\",\n            &format!(\"invoke:{}\", definition.summary.name),\n            definition.summary.required_permission,\n            true,\n        )\n        .map_err(|error| anyhow::anyhow!(error.message))?;\n        loaded_skills.push(definition);\n    }\n\n    let skill_context = loaded_skills\n        .iter()\n        .map(|skill| {\n            json!({\n                \"name\": skill.summary.name,\n                \"description\": skill.summary.description,\n                \"source\": skill.summary.source,\n                \"provider\": skill.summary.provider,\n                \"required_permission\": skill.summary.required_permission,\n                \"content\": clip_skill_content(&skill.content, 65_536),\n            })\n        })\n        .collect::<Vec<_>>();\n    let loaded_names = loaded_skills\n        .iter()\n        .map(|skill| skill.summary.name.clone())\n        .collect::<Vec<_>>();\n    let task = SubagentTask {\n        goal: request.goal,\n        context: json!({\n            \"user_context\": request.context,\n            \"zero3\": {\n                \"routing\": &decision,\n                \"skills\": skill_context,\n                \"skill_catalog_complete\": snapshot.complete,\n            }\n        }),\n    };\n\n    let route = if request.backend == \"auto\" {\n        std::iter::once(decision.backend.clone())\n            .chain(decision.fallbacks.iter().cloned())\n            .collect::<Vec<_>>()\n    } else {\n        vec![decision.backend.clone()]\n    };\n    let mut attempted_backends = Vec::new();\n    let mut failures = Vec::new();\n    for backend in route {\n        attempted_backends.push(backend.clone());\n        match state.agents.dispatch(&backend, task.clone()).await {\n            Ok(result) => {\n                return Ok(json!({\n                    \"summary\": result.summary,\n                    \"output\": result.output,\n                    \"routing\": decision,\n                    \"skills\": loaded_names,\n                    \"attempted_backends\": attempted_backends,\n                    \"skill_catalog_complete\": snapshot.complete,\n                }));\n            }\n            Err(error) => failures.push(format!(\"{backend}: {error:#}\")),\n        }\n    }\n\n    Err(anyhow::anyhow!(\n        \"all routed agent backends failed: {}\",\n        failures.join(\" | \")\n    ))\n}\n\nfn clip_skill_content(content: &str, max_chars: usize) -> String {\n    if content.chars().count() <= max_chars {\n        return content.to_string();\n    }\n    content.chars().take(max_chars).collect()\n}\n\n#[cfg(test)]\nmod tests {\n    use super::clip_skill_content;\n\n    #[test]\n    fn skill_content_clipping_preserves_utf8_boundaries() {\n        let value = \"零三\".repeat(100);\n        let clipped = clip_skill_content(&value, 17);\n        assert_eq!(clipped.chars().count(), 17);\n        assert!(clipped.is_char_boundary(clipped.len()));\n    }\n}\n"
    }
  }
}