{
  "schema":"zero3.commander.command.execution-submit/1.0",
  "command":"execution.submit",
  "execution_id":"chatgpt-router-node-router-import4-20260829T0143Z",
  "commander_id":"chatgpt-web-session",
  "issued_at":"2026-08-29T01:43:00Z",
  "payload":{"capability":"file.patch","args":{"diff":"diff --git a/apps/node/src/main.rs b/apps/node/src/main.rs\n--- a/apps/node/src/main.rs\n+++ b/apps/node/src/main.rs\n@@ -36,6 +36,6 @@\n use zero3_scheduler::{JobManager, JobRecord, RecoveryMode};\n use zero3_store::EventStore;\n use zero3_subagents::workers::{ClaudeWorker, CliWorkerConfig, CodexWorker, HermesWorker};\n-use zero3_subagents::SubagentRegistry;\n+use zero3_subagents::{HeuristicAgentRouter, SubagentRegistry};\n \n const VERSION: &str = env!(\"CARGO_PKG_VERSION\");\n"},"execution_id":"chatgpt-router-node-router-import4-20260829T0143Z"}
}
