{
  "schema": "zero3.commander.command.execution-submit/1.0",
  "command": "execution.submit",
  "execution_id": "chatgpt-canary-20260828T144436Z-db3abd",
  "commander_id": "chatgpt-web-session",
  "issued_at": "2026-08-28T14:44:36Z",
  "payload": {
    "capability": "test.clippy",
    "args": {},
    "execution_id": "chatgpt-canary-20260828T144436Z-db3abd"
  }
}