{
  "schema": "zero3.commander.command.execution-submit/1.0",
  "command": "execution.submit",
  "protocol_version": "1.0",
  "execution_id": "chatgpt-router-weixin-default-auto-20260829T0227Z",
  "commander_id": "chatgpt-web-session",
  "issued_at": "2026-08-29T02:27:00Z",
  "idempotency_key": "chatgpt-router-weixin-default-auto-20260829T0227Z",
  "payload": {
    "execution_id": "chatgpt-router-weixin-default-auto-20260829T0227Z",
    "capability": "file.patch",
    "args": {
      "diff": "diff --git a/apps/weixin/src/main.rs b/apps/weixin/src/main.rs\n--- a/apps/weixin/src/main.rs\n+++ b/apps/weixin/src/main.rs\n@@ -52,3 +52,3 @@\n fn default_backend() -> String {\n-    std::env::var(\"ZERO3_WEIXIN_AGENT\").unwrap_or_else(|_| \"codex\".to_string())\n+    std::env::var(\"ZERO3_WEIXIN_AGENT\").unwrap_or_else(|_| \"auto\".to_string())\n }\n"
    }
  }
}