{
  "schema":"zero3.commander.command.execution-submit/1.0",
  "command":"execution.submit",
  "protocol_version":"1.0",
  "execution_id":"chatgpt-skills-rec-branch-20260829T0248Z",
  "commander_id":"chatgpt-web-session",
  "issued_at":"2026-08-29T02:48:00Z",
  "idempotency_key":"chatgpt-skills-rec-branch-20260829T0248Z",
  "payload":{"execution_id":"chatgpt-skills-rec-branch-20260829T0248Z","capability":"file.patch","args":{"diff":"diff --git a/crates/zero3-skills/src/lib.rs b/crates/zero3-skills/src/lib.rs\n--- a/crates/zero3-skills/src/lib.rs\n+++ b/crates/zero3-skills/src/lib.rs\n@@ -174,4 +174,8 @@\n     fn discover_root(&self, root: &SkillRoot) -> anyhow::Result<Vec<SkillCandidate>> {\n+        if self.recursive {\n+            return self.discover_root_recursive(root);\n+        }\n+\n         if !root.path.exists() {\n             return Ok(Vec::new());\n         }\n"}}
}