{
  "schema":"zero3.commander.command.execution-submit/1.0","command":"execution.submit","protocol_version":"1.0",
  "execution_id":"chatgpt-node-fix1-20260828T1954Z","commander_id":"chatgpt-web-session","issued_at":"2026-08-28T19:54:00Z","idempotency_key":"chatgpt-node-fix1-20260828T1954Z",
  "payload":{"execution_id":"chatgpt-node-fix1-20260828T1954Z","capability":"file.patch","args":{"diff":"diff --git a/apps/node/src/main.rs b/apps/node/src/main.rs\n--- a/apps/node/src/main.rs\n+++ b/apps/node/src/main.rs\n@@ -4,6 +4,5 @@\n //! desktop UI, providers, subagents, persistent jobs, schedules, and memory.\n //! Side-effecting browser/computer/subagent requests are routed through the\n //! shared `zero3-core` policy seam before execution.\n \n-use std::collections::HashMap;\n use std::net::SocketAddr;\n@@ -263,3 +262,3 @@ fn computer_policy(action: &ComputerAction) -> (&'static str, PermissionLevel, bool) {\n     match action {\n-        ComputerAction::Screenshot { .. } => (\"computer.read\", PermissionLevel::ReadOnly, true),\n+        ComputerAction::ListApps | ComputerAction::Screenshot { .. } => (\"computer.read\", PermissionLevel::ReadOnly, true),\n         ComputerAction::Click { .. }\n"}}
}