{
  "schema": "zero3.commander.command.execution-submit/1.0",
  "command": "execution.submit",
  "protocol_version": "1.0",
  "execution_id": "chatgpt-router-skills-build3-20260829T0231Z",
  "commander_id": "chatgpt-web-session",
  "issued_at": "2026-08-29T02:31:00Z",
  "idempotency_key": "chatgpt-router-skills-build3-20260829T0231Z",
  "payload": {
    "execution_id": "chatgpt-router-skills-build3-20260829T0231Z",
    "capability": "test.build",
    "args": {}
  }
}