{
  "schema": "zero3.commander.command.execution-submit/1.0",
  "command": "execution.submit",
  "execution_id": "chatgpt-autonomy-fmt-20260828T1632Z",
  "commander_id": "chatgpt-web-session",
  "issued_at": "2026-08-28T16:32:20Z",
  "payload": {
    "capability": "test.fmt",
    "args": {},
    "execution_id": "chatgpt-autonomy-fmt-20260828T1632Z"
  }
}
