{
  "schema": "zero3.commander.command.execution-submit/1.0",
  "command": "execution.submit",
  "protocol_version": "1.0",
  "execution_id": "chatgpt-final-test-20260828T1819Z",
  "commander_id": "chatgpt-web-session",
  "issued_at": "2026-08-28T18:19:00Z",
  "payload": {
    "execution_id": "chatgpt-final-test-20260828T1819Z",
    "capability": "test.run",
    "args": {}
  }
}