{
  "schema": "zero3.commander.command.execution-submit/1.0",
  "command": "execution.submit",
  "execution_id": "chatgpt-installer-weixin-fmt-final-20260828T2123Z",
  "commander_id": "chatgpt-web-session",
  "issued_at": "2026-08-28T21:23:30Z",
  "payload": {
    "capability": "test.fmt",
    "args": {},
    "execution_id": "chatgpt-installer-weixin-fmt-final-20260828T2123Z"
  }
}