{
  "schema": "zero3.commander.command.execution-submit/1.0",
  "command": "execution.submit",
  "protocol_version": "1.0",
  "execution_id": "chatgpt-ocu-refresh-20260828T1832Z",
  "commander_id": "chatgpt-web-session",
  "issued_at": "2026-08-28T18:32:00Z",
  "payload": {
    "execution_id": "chatgpt-ocu-refresh-20260828T1832Z",
    "capability": "repo.checkout",
    "args": {
      "ref": "pilot-dev-complete-runtime-20260829"
    }
  }
}