{
  "schema": "zero3.commander.command.execution-submit/1.0",
  "command": "execution.submit",
  "protocol_version": "1.0",
  "execution_id": "chatgpt-router-wip-status-20260829T0216Z",
  "commander_id": "chatgpt-web-session",
  "issued_at": "2026-08-29T02:16:00Z",
  "idempotency_key": "chatgpt-router-wip-status-20260829T0216Z",
  "payload": {
    "execution_id": "chatgpt-router-wip-status-20260829T0216Z",
    "capability": "repo.status",
    "args": {}
  }
}